Reference Seq,Position,Mutation Type,Sequence Change,Gene,Function,Product,GO Process,GO Component,Mut ID,Details,42C A1 F124 I1 R1,42C A2 F163 I1 R1,42C A3 F120 I1 R1,42C A4 F161 I1 R1,42C A5 F125 I1 R1,42C A6 F164 I1 R1,42C A7 F135 I1 R1,42C A8 F164 I1 R1,42C A9 F131 I1 R1,42C A10 F153 I1 R1
43264,NC_000913,"3,361,426",DEL,Δ1 bp,gltF,,periplasmic protein,,,coding (251/765 nt),,1.00,,,,,,,,
43265,NC_000913,"3,931,183",INS,(G)7→8,"ravA, kup",,"hexameric AAA+ MoxR family ATPase, putative molecular chaperone/potassium transporter",,,intergenic (‑90/‑133),,1.00,,,,,,,,
43266,NC_000913,"4,187,550",SNP,C→T,rpoC,,"RNA polymerase, beta prime subunit",,,A734V (GCG→GTG),1.00,1.00,,,,,,,,
43267,NC_000913,"4,525,413",DEL,(T)6→5,yjhI,,putative DNA-binding transcriptional regulator,,,coding (391/789 nt),,1.00,,,,,,,,
43268,NC_000913,"528,665",SNP,C→T,ybbD,,pseudogene,,,pseudogene (26/491 nt),,,,,,1.00,,,,
43269,NC_000913,"1,103,510",SNP,G→A,"csgD, csgB",,"csgBAC operon transcriptional regulator/curlin nucleator protein, minor subunit in curli complex",,,intergenic (‑314/‑441),,,,,,1.00,,,,
43270,NC_000913,"1,264,999",SNP,T→A,"hemA, prfA",,glutamyl tRNA reductase/peptide chain release factor RF-1,,,intergenic (+29/‑13),,,,,,1.00,,,,
43271,NC_000913,"1,420,038",SNP,T→A,racR,,"Rac prophage, putative DNA-binding transcriptional regulator",,,P68P (CCA→CCT),,,,,,1.00,,,,
43272,NC_000913,"1,458,804",SNP,A→T,paaG,,"1,2-epoxyphenylacetyl-CoA isomerase, oxepin-CoA-forming",,,I181F (ATC→TTC),,,,,,1.00,,,,
43273,NC_000913,"1,896,268",SNP,T→A,nudL,,"putative CoA pyrophosphohydrolase, weak 3-phosphohydroxypyruvate phosphatase",,,A33A (GCT→GCA),,,,,,1.00,,,,
43274,NC_000913,"2,234,512",SNP,T→A,preT,,"dihydropyrimidine dehydrogenase, NADH-dependent, subunit N",,,G160G (GGT→GGA),,,,,,1.00,,,,
43275,NC_000913,"2,469,686",SNP,C→T,gtrS,,"serotype-specific glucosyl transferase, CPS-53 (KpLE1) prophage",,,Q186* (CAA→TAA),,,,,,1.00,,,,
43276,NC_000913,"2,614,327",SNP,T→A,focB,,putative formate transporter,,,W132R (TGG→AGG),,,,,,1.00,,,,
43277,NC_000913,"2,644,342",SNP,G→A,"rlmN, ndk",,"dual specificity 23S rRNA m(2)A2503, tRNA m(2)A37 methyltransferase, SAM-dependent/multifunctional nucleoside diphosphate kinase and apyrimidinic endonuclease and 3'-phosphodiesterase",,,intergenic (‑59/+91),,,,,,1.00,,,,
43278,NC_000913,"2,752,089",SNP,A→T,recN,,recombination and repair protein,,,S99C (AGC→TGC),,,,,,1.00,,,,
43279,NC_000913,"2,996,015",INS,(T)8→9,ygeN;ygeO,,"pseudogene, orgB family, part of T3SS PAI ETT2 remnant;pseudogene, orgA family, part of T3SS PAI ETT2 remnant",,,pseudogene (6/261 nt)pseudogene (346/399 nt),,,,,,1.00,,,,
43280,NC_000913,"3,267,638",SNP,T→C,"tdcR, yhaB",,L-threonine dehydratase operon activator protein/uncharacterized protein,,,intergenic (+40/‑216),,,,,,1.00,,,,
43281,NC_000913,"3,924,915",SNP,A→T,mnmG,,5-methylaminomethyl-2-thiouridine modification at tRNA U34,,,V240E (GTG→GAG),,,,,,1.00,,,,
43282,NC_000913,"3,950,467",SUB,2 bp→TT,"ilvL, ilvX",,ilvG operon leader peptide/uncharacterized protein,,,intergenic (+47/‑39),,,,,,1.00,,,,
43283,NC_000913,"4,310,950",SNP,T→A,alsA,,D-allose ABC transporter ATPase,,,I11F (ATC→TTC),,,,,,1.00,,,,
43284,NC_000913,"4,572,279",SNP,A→T,"yjiS, yjiT",,DUF1127 family protein/pseudogene,,,intergenic (+364/‑135),,,,,,1.00,,,,
43285,NC_000913,"702,352",DEL,Δ21 bp,nagA,,N-acetylglucosamine-6-phosphate deacetylase,,,coding (380‑400/1149 nt),1.00,,,,,,,,,
43286,NC_000913,"1,308,318",SNP,G→C,clsA,,cardiolipin synthase 1,,,R110G (CGT→GGT),1.00,,,,,,,,,
43287,NC_000913,"2,173,364",DEL,Δ1 bp,"gatC, gatC",,"pseudogene, galactitol-specific enzyme IIC component of PTS,transport, Transport of small molecules: Carbohydrates, organic acids, alcohols, PTS system galactitol-specific enzyme IIC/pseudogene, galactitol-specific enzyme IIC component of PTS,transport, Transport of small molecules: Carbohydrates, organic acids, alcohols, PTS system galactitol-specific enzyme IIC",,,intergenic (‑2/+1),1.00,,,,,,,,,
37938,NC_000913,"1,979,486",MOB,IS5 (+) +4 bp,"insA, uspC",,IS1 repressor TnpA/universal stress protein,,,intergenic (‑271/‑264),1.00,1.00,1.00,1.00,1.00,,1.00,,1.00,1.00
38212,NC_000913,"380,022",DEL,(G)10→9,"frmR, yaiO",,regulator protein that represses frmRAB operon/outer membrane protein,,,intergenic (‑141/+47),,1.00,1.00,,,,,,,
26183,NC_000913,"1,978,503",DEL,Δ776 bp,"insB1, insA",,"insB1, insA",,,,1.00,1.00,1.00,1.00,1.00,1.00,1.00,1.00,,1.00
26191,NC_000913,"1,299,499",DEL,"Δ1,199 bp","ychE, oppA",,UPF0056 family inner membrane protein/oligopeptide ABC transporter periplasmic binding protein,,,intergenic (+254/‑485),1.00,,,,1.00,,1.00,,1.00,1.00
43152,NC_000913,"497,139",INS,(T)5→6,"htpG, adk",,"protein refolding molecular co-chaperone Hsp90, Hsp70-dependent, heat-shock protein, ATPase/adenylate kinase",,,intergenic (+145/‑36),,,,,,,,1.00,,
43129,NC_000913,"843,749",SNP,C→A,ybiO,,"mechanosensitive channel protein, intermediate conductance",,,D578Y (GAT→TAT),,,,,,,,,,1.00
43156,NC_000913,"772,209",SNP,C→A,cydA,,"cytochrome d terminal oxidase, subunit I",,,T251N (ACC→AAC),,,,,,,,1.00,,
43130,NC_000913,"1,756,529",SNP,A→T,pykF,,pyruvate kinase I,,,T278S (ACC→TCC),,,,,,,,,,1.00
43131,NC_000913,"2,750,720",SNP,C→T,"grpE, nadK",,heat shock protein/NAD kinase,,,intergenic (‑12/‑111),,,,,,,,,,1.00
43132,NC_000913,"2,810,759",SNP,G→A,"ygaH, mprA",,"putative L-valine exporter, norvaline resistance protein/transcriptional repressor of microcin B17 synthesis and multidrug efflux",,,intergenic (+80/‑11),,,,,,,,,,1.00
43133,NC_000913,"4,072,171",SNP,C→A,yihT,,6-deoxy-6-sulphofructose-1-phosphate aldolase,,,V161F (GTC→TTC),,,,,,,,,,1.00
43134,NC_000913,"4,078,996",SNP,G→T,"yiiD, yiiE",,GNAT family putative N-acetyltransferase/CopG family putative transcriptional regulator,,,intergenic (+558/‑301),,,,,,,,,,1.00
43135,NC_000913,"1,115,627",SNP,C→T,"mdtG, lpxL",,putative drug efflux system protein/lauryl-acyl carrier protein (ACP)-dependent acyltransferase,,,intergenic (‑137/+35),,,,1.00,,,,,,
43136,NC_000913,"1,756,553",SNP,A→T,pykF,,pyruvate kinase I,,,K286* (AAA→TAA),,,,1.00,1.00,,1.00,,,
43137,NC_000913,"2,270,300",MOB,IS5 (+) +4 bp,mepS,,"murein DD-endopeptidase, space-maker hydrolase, mutational suppressor of prc thermosensitivity, outer membrane lipoprotein, weak murein LD-carboxypeptidase",,,coding (322‑325/567 nt),,,,1.00,,,,,,
43138,NC_000913,"2,810,760",SNP,T→C,"ygaH, mprA",,"putative L-valine exporter, norvaline resistance protein/transcriptional repressor of microcin B17 synthesis and multidrug efflux",,,intergenic (+81/‑10),,,,1.00,1.00,,,,,
43139,NC_000913,"3,338,928",SNP,C→A,mlaE,,"ABC transporter maintaining OM lipid asymmetry, inner membrane permease protein",,,L107F (TTG→TTT),,,,1.00,1.00,,1.00,,,
43140,NC_000913,"3,410,998",MOB,IS2 (+) +5 bp,dusB,,tRNA-dihydrouridine synthase B,,,coding (719‑723/966 nt),,,,1.00,,,,,,
43141,NC_000913,"3,966,598",SNP,G→A,rho,,transcription termination factor,,,G61E (GGA→GAA),,,,1.00,,,,,,
43142,NC_000913,"2,754,639",SNP,C→A,ratA,,toxic UPF0083 family protein inhibitor of 70S ribosome formation,,,Q42H (CAG→CAT),,,,,1.00,,,,,
43143,NC_000913,"3,793,843",MOB,IS2 (–) +5 bp,"yibB, hldD",,"YibB family protein, function unknown/ADP-L-glycero-D-mannoheptose-6-epimerase, NAD(P)-binding",,,intergenic (‑160/‑140),,,,,1.00,,,,,
43144,NC_000913,"4,191,997",SNP,G→C,thiG,,thiamine biosynthesis ThiGH complex subunit,,,P213P (CCC→CCG),,,,,1.00,,,,,
43145,NC_000913,"36,231",SNP,T→C,"caiD, caiC",,carnitinyl-CoA dehydratase/putative crotonobetaine/carnitine-CoA ligase,,,intergenic (‑69/+40),,,,,,,,1.00,,
43146,NC_000913,"162,973",SNP,G→A,hrpB,,putative ATP-dependent helicase,,,C290Y (TGT→TAT),,,,,,1.00,,1.00,,
43147,NC_000913,"190,553",DEL,Δ14 bp,rpsB,,30S ribosomal subunit protein S2,,,coding (680‑693/726 nt),,,,,,,,1.00,,
43148,NC_000913,"216,568",SNP,C→T,yaeF,,putative lipoprotein,,,A146T (GCC→ACC),,,,,,,,1.00,,
43149,NC_000913,"228,818",SNP,C→A,rrfH,,5S ribosomal RNA of rrnH operon,,,noncoding (63/120 nt),,,,,,,,1.00,,
43150,NC_000913,"236,541",SNP,C→T,dnaQ,,DNA polymerase III epsilon subunit,,,R159* (CGA→TGA),,,,,,1.00,,1.00,,
43151,NC_000913,"428,188",SNP,G→T,secD,,SecYEG protein translocase auxillary subunit,,,R181L (CGC→CTC),,,,,,,,1.00,,
40592,NC_000913,"3,815,859",DEL,Δ82 bp,"[rph], [rph]",,"[rph], [rph]",,,,1.00,1.00,1.00,1.00,1.00,,1.00,,1.00,1.00
43153,NC_000913,"520,993",SNP,T→G,ybbP,,putative ABC transporter permease,,,V193G (GTC→GGC),,,,,,,,1.00,,
43154,NC_000913,"700,805",SNP,A→T,nagC,,N-acetylglucosamine-inducible nag divergent operon transcriptional repressor,,,C264S (TGC→AGC),,,,,,1.00,,1.00,,
43155,NC_000913,"720,946",SNP,C→T,"ybfK, kdpE",,uncharacterized protein/response regulator in two-component regulatory system with KdpD,,,intergenic (+106/+110),,,,,,1.00,,1.00,,
40596,NC_000913,"4,189,448",SNP,C→T,rpoC,,"RNA polymerase, beta prime subunit",,,Q1367* (CAG→TAG),,,,,1.00,,1.00,,,1.00
43157,NC_000913,"882,722",SNP,G→A,deoR,,"deoxyribose-5-phosphate-inducible deoxyribose operon transcriptional repressor, repressor of nupG and tsx",,,R5C (CGC→TGC),,,,,,,,1.00,,
43158,NC_000913,"894,155",SNP,T→G,potF,,putrescine ABC transporter periplasmic binding protein,,,D124E (GAT→GAG),,,,,,,,1.00,,
43159,NC_000913,"1,100,233",SNP,G→A,"ycdY, ycdZ",,redox enzyme maturation protein (REMP) chaperone for YcdX/DUF1097 family inner membrane protein,,,intergenic (+39/‑63),,,,,,,,1.00,,
43160,NC_000913,"1,143,125",SNP,C→T,rne,,"endoribonuclease, RNA-binding protein,RNA degradosome binding protein",,,D415N (GAC→AAC),,,,,,1.00,,1.00,,
43161,NC_000913,"1,197,739",SNP,A→G,ymfE,,"e14 prophage, putative inner membrane protein",,,S167P (TCC→CCC),,,,,,1.00,,1.00,,
43162,NC_000913,"1,292,944",SNP,T→C,"hns, tdk",,global DNA-binding transcriptional dual regulator H-NS/thymidine kinase/deoxyuridine kinase,,,intergenic (‑22/‑583),,,,,,1.00,,1.00,,
43163,NC_000913,"1,401,844",SNP,A→G,abgB,,"p-aminobenzoyl-glutamate hydrolase, B subunit",,,I471T (ATC→ACC),,,,,,1.00,,1.00,,
43164,NC_000913,"1,434,459",SNP,C→T,"ynaE, ttcC",,"cold shock protein, Rac prophage/pseudogene, prophage Rac integration site ttcA duplication,Phage or Prophage Related",,,intergenic (‑235/+499),,,,,,1.00,,1.00,,
43165,NC_000913,"1,501,912",SNP,T→A,tehB,,"tellurite, selenium methyltransferase, SAM-dependent, tellurite, selenium resistance protein",,,I117I (ATT→ATA),,,,,,,,1.00,,
43166,NC_000913,"1,530,076",INS,(A)7→8,ydcD,,putative immunity protein for RhsE,,,coding (155/483 nt),,,,,,1.00,,1.00,,
43167,NC_000913,"1,580,094",SNP,C→T,ydeM,,putative YdeN-specific sulfatase-maturating enzyme,,,D233N (GAT→AAT),,,,,,,,1.00,,
43168,NC_000913,"1,665,195",INS,(T)7→8,"dmsD, clcB",,twin-argninine leader-binding protein for DmsA and TorA/H(+)/Cl(-) exchange transporter,,,intergenic (+75/‑120),,,,,,1.00,,1.00,,
43169,NC_000913,"1,681,932",SNP,T→C,ydgC,,GlpM family inner membrane protein,,,P33P (CCA→CCG),,,,,,1.00,,1.00,,
43170,NC_000913,"1,712,306",INS,(T)7→8,"nth, dtpA",,DNA glycosylase and apyrimidinic (AP) lyase (endonuclease III)/dipeptide and tripeptide permease A,,,intergenic (+148/‑463),,,,,,,,1.00,,
43171,NC_000913,"1,712,518",DEL,(C)6→5,"nth, dtpA",,DNA glycosylase and apyrimidinic (AP) lyase (endonuclease III)/dipeptide and tripeptide permease A,,,intergenic (+360/‑251),,,,,,,,1.00,,
43172,NC_000913,"1,728,444",SNP,C→A,rnt,,"RNase T, exoribonuclease T, structured DNA 3' exonuclease, RNA processing, DNA repair",,,T33N (ACC→AAC),,,,,,,,1.00,,
43173,NC_000913,"1,827,031",SNP,T→A,astB,,succinylarginine dihydrolase,,,D410V (GAT→GTT),,,,,,,,1.00,,
43174,NC_000913,"1,983,761",SNP,C→T,araG,,L-arabinose ABC transporter ATPase,,,E437K (GAA→AAA),,,,,,1.00,,1.00,,
43175,NC_000913,"2,071,321",SNP,A→G,isrC,,"novel sRNA, CP4-44, putative prophage remnant",,,noncoding (5/195 nt),,,,,,1.00,,1.00,,
43176,NC_000913,"2,191,432",SNP,C→T,yehC,,putative periplasmic pilin chaperone,,,G72S (GGC→AGC),,,,,,1.00,,1.00,,
43177,NC_000913,"2,210,811",SNP,C→T,yehQ,,pseudogene,,,pseudogene (1712/2001 nt),,,,,,1.00,,1.00,,
43178,NC_000913,"2,278,298",SNP,C→T,"yejG, bcr",,uncharacterized protein/bicyclomycin/cysteine/sulfonamide efflux transporter,,,intergenic (‑61/+272),,,,,,,,1.00,,
43179,NC_000913,"2,436,937",SNP,A→T,pdxB,,erythronate-4-phosphate dehydrogenase,,,D305E (GAT→GAA),,,,,,,,1.00,,
43180,NC_000913,"2,469,656",INS,(T)7→8,gtrS,,"serotype-specific glucosyl transferase, CPS-53 (KpLE1) prophage",,,coding (526/1332 nt),,,,,,,,1.00,,
43181,NC_000913,"2,521,967",SNP,C→A,xapR,,transcriptional activator of xapAB,,,A171S (GCG→TCG),,,,,,,,1.00,,
43182,NC_000913,"2,563,518",INS,(A)5→6,"yffP, yffQ",,"CPZ-55 prophage, uncharacterized protein/CPZ-55 prophage, uncharacterized protein",,,intergenic (+401/‑74),,,,,,1.00,,1.00,,
43183,NC_000913,"2,564,525",SNP,G→A,yffS,,"CPZ-55 prophage, uncharacterized protein",,,M1M (ATG→ATA) †,,,,,,1.00,,1.00,,
43184,NC_000913,"2,600,288",SNP,C→T,gcvR,,"transcriptional repressor, regulatory protein accessory to GcvA",,,S128L (TCG→TTG),,,,,,,,1.00,,
43185,NC_000913,"2,810,756",SNP,G→A,"ygaH, mprA",,"putative L-valine exporter, norvaline resistance protein/transcriptional repressor of microcin B17 synthesis and multidrug efflux",,,intergenic (+77/‑14),,,,,,1.00,,1.00,,
43186,NC_000913,"2,852,356",SNP,T→A,hypD,,hydrogenase maturation protein,,,L74Q (CTG→CAG),,,,,,,,1.00,,
43187,NC_000913,"2,887,352",SNP,T→A,"ygcB, sokX",,"Cascade complex anti-viral R-loop helicase-annealase Cas3/sok-related sRNA, function unknown",,,intergenic (‑133/‑2),,,,,,1.00,,1.00,,
43188,NC_000913,"3,452,057",SNP,A→T,rplD,,50S ribosomal subunit protein L4,,,I77N (ATC→AAC),,,,,,,,1.00,,
43189,NC_000913,"3,622,796",SNP,T→G,rhsB,,"Rhs protein with DUF4329 family putative toxin domain, putative neighboring cell growth inhibitor",,,L1202R (CTG→CGG),,,,,,,,1.00,,
43190,NC_000913,"3,648,042",SNP,T→C,"dinQ, agrA",,"UV-inducible membrane toxin, DinQ-AgrB type I toxin-antitoxin system/inactive antisense sRNA",,,intergenic (‑254/‑21),,,,,,,,1.00,,
43191,NC_000913,"3,853,909",SNP,A→G,"tisB, emrD",,"toxic membrane persister formation peptide, LexA-regulated/multidrug efflux system protein",,,intergenic (+267/‑13),,,,,,1.00,,1.00,,
43192,NC_000913,"3,910,662",SNP,A→T,pstS,,phosphate ABC transporter periplasmic binding protein,,,D288E (GAT→GAA),,,,,,,,1.00,,
43193,NC_000913,"3,950,468",SNP,G→T,"ilvL, ilvX",,ilvG operon leader peptide/uncharacterized protein,,,intergenic (+48/‑39),,,,,,,,1.00,,
43194,NC_000913,"3,971,690",SNP,A→C,wecC,,UDP-N-acetyl-D-mannosaminuronic acid dehydrogenase,,,Q144P (CAG→CCG),,,,,,1.00,,1.00,,
43195,NC_000913,"4,168,540",SNP,T→A,"gltT, rrlB",,tRNA-Glu/23S ribosomal RNA of rrnB operon,,,intergenic (+93/‑101),,,,,,,,1.00,,
43196,NC_000913,"4,235,689",INS,+A,"pgi, yjbE",,glucosephosphate isomerase/extracellular polysaccharide production threonine-rich protein,,,intergenic (+282/‑217),,,,,,1.00,,1.00,,
43197,NC_000913,"4,242,942",DEL,Δ66 bp,malG,,maltose transporter subunit,,,coding (510‑575/891 nt),,,,,,,,1.00,,
43198,NC_000913,"4,490,055",SNP,T→G,yjgR,,DUF853 family protein with NTPase fold,,,E3D (GAA→GAC),,,,,,,,1.00,,
43199,NC_000913,"4,615,859",SNP,T→G,yjjI,,"DUF3029 family protein, putative glycine radical enzyme",,,T403P (ACC→CCC),,,,,,1.00,,1.00,,
43200,NC_000913,"4,631,700",SNP,T→C,slt,,"lytic murein transglycosylase, soluble",,,L323P (CTT→CCT),,,,,,,,1.00,,
43201,NC_000913,"263,172",SNP,A→C,ykfN,,"pseudogene, YdiA family",,,pseudogene (41/63 nt),,,,,,,1.00,,,
43202,NC_000913,"1,914,888",SNP,T→G,proQ,,"RNA chaperone, putative ProP translation regulator",,,Q216P (CAG→CCG),,,,,,,1.00,,,
43203,NC_000913,"3,684,604",SNP,G→A,yhjK,,cyclic-di-GMP phosphodiesterase,,,Q339* (CAG→TAG),,,,,,,1.00,,,
43204,NC_000913,"4,400,313",SNP,A→C,hfq,,"global sRNA chaperone, HF-I, host factor for RNA phage Q beta replication",,,D9A (GAT→GCT),1.00,,,,,,1.00,,,
43205,NC_000913,"107,553",DEL,(T)9→8,"lpxC, secM",,UDP-3-O-acyl N-acetylglucosamine deacetylase/regulator of secA translation,,,intergenic (+79/‑152),,,1.00,,,,,,,
43206,NC_000913,"410,479",SNP,A→G,mak,,manno(fructo)kinase,,,S112S (TCA→TCG),,,1.00,,,,,,,
43207,NC_000913,"953,802",SNP,A→G,focA,,formate channel,,,V222A (GTA→GCA),,,1.00,,,,,,,
43208,NC_000913,"1,143,641",SNP,G→A,rne,,"endoribonuclease, RNA-binding protein,RNA degradosome binding protein",,,H243Y (CAT→TAT),,,1.00,,,,,,,
43209,NC_000913,"1,246,073",SNP,C→T,treA,,periplasmic trehalase,,,G435D (GGC→GAC),,,1.00,,,,,,,
43210,NC_000913,"1,489,197",SNP,C→T,aldA,,"aldehyde dehydrogenase A, NAD-linked",,,D322D (GAC→GAT),,,1.00,,,,,,,
43211,NC_000913,"1,755,639",SNP,G→A,"ydhZ, pykF",,uncharacterized protein/pyruvate kinase I,,,intergenic (‑498/‑59),,,1.00,,,,,,,
43212,NC_000913,"1,868,250",SNP,A→G,yeaG,,"protein kinase, endogenous substrate unidentified, autokinase",,,Y448C (TAC→TGC),,,1.00,,,,,,,
43213,NC_000913,"2,018,260",DEL,(A)8→7,fliJ,,flagellar protein,,,coding (315/444 nt),,,1.00,,,,,,,
43214,NC_000913,"2,470,410",DEL,(T)7→6,gtrS,,"serotype-specific glucosyl transferase, CPS-53 (KpLE1) prophage",,,coding (1280/1332 nt),,,1.00,,,,,,,
43215,NC_000913,"2,516,689",SNP,T→C,yfeA,,putative diguanylate cyclase,,,T382A (ACG→GCG),,,1.00,,,,,,,
43216,NC_000913,"2,652,855",INS,(G)6→7,sseA,,3-mercaptopyruvate sulfurtransferase,,,coding (362/846 nt),,,1.00,,,,,,,
43217,NC_000913,"2,731,312",SNP,G→A,"rrsG, clpB",,16S ribosomal RNA of rrnG operon/protein disaggregation chaperone,,,intergenic (‑155/+288),,,1.00,,,,,,,
43218,NC_000913,"2,866,592",INS,+C,rpoS,,"RNA polymerase, sigma S (sigma 38) factor",,,coding (960/993 nt),,,1.00,,,,,,,
43219,NC_000913,"3,008,075",SNP,A→G,ygeX,,"2,3-diaminopropionate ammonia lyase, PLP-dependent",,,D189G (GAC→GGC),,,1.00,,,,,,,
43220,NC_000913,"3,194,516",SNP,A→G,yqiK,,"PHB family membrane protein, function unknown",,,K551K (AAA→AAG),,,1.00,,,,,,,
43221,NC_000913,"3,352,673",SNP,T→C,arcB,,"aerobic respiration control sensor histidine protein kinase, cognate to two-component response regulators ArcA and RssB",,,E118G (GAA→GGA),,,1.00,,,,,,,
43222,NC_000913,"3,379,266",INS,(C)7→8,zapE,,divisome ATPase,,,coding (732/1128 nt),,1.00,1.00,,,,,,,
43223,NC_000913,"3,411,299",SNP,T→C,fis,,global DNA-binding transcriptional dual regulator,,,V10A (GTA→GCA),,,1.00,,,,,,,
43224,NC_000913,"3,582,206",DEL,"Δ1,222 bp","[yhhZ], yrhA",,"[yhhZ], yrhA",,,IS1‑mediated,,1.00,1.00,,,,,,,
43225,NC_000913,"3,648,144",DEL,(T)7→6,agrA,,inactive antisense sRNA,,,noncoding (82/84 nt),,,1.00,,,,,,,
43226,NC_000913,"4,296,060",SNP,C→T,"gltP, yjcO",,glutamate/aspartate:proton symporter/Sel1 family TPR-like repeat protein,,,intergenic (+266/+376),,,1.00,,,,,,,
43227,NC_000913,"4,337,024",SNP,G→A,adiC,,arginine:agmatine antiporter,,,S3L (TCG→TTG),,,1.00,,,,,,,
43228,NC_000913,"4,397,557",SNP,G→T,mutL,,methyl-directed mismatch repair protein,,,G49V (GGT→GTT),,1.00,1.00,,,,,,,
43229,NC_000913,"4,410,053",DEL,(T)9→8,"rlmB, yjfI",,"23S rRNA mG2251 2'-O-ribose methyltransferase, SAM-dependent/DUF2170 family protein",,,intergenic (+47/‑80),,,1.00,,,,,,,
43230,NC_000913,"4,494,883",INS,(A)7→8,idnK,,"D-gluconate kinase, thermosensitive",,,coding (261/564 nt),,,1.00,,,,,,,
43231,NC_000913,"4,573,528",SNP,A→G,yjiT,,pseudogene,,,pseudogene (1115/1503 nt),,,1.00,,,,,,,
43232,NC_000913,"4,638,193",INS,(C)6→7,creD,,inner membrane protein,,,coding (16/1353 nt),,,1.00,,,,,,,
43233,NC_000913,"147,727",DEL,Δ12 bp,yadD,,transposase_31 family protein,,,coding (760‑771/903 nt),,,,,,,,,1.00,
43234,NC_000913,"1,143,998",SNP,C→T,rne,,"endoribonuclease, RNA-binding protein,RNA degradosome binding protein",,,G124S (GGT→AGT),,,,,,,,,1.00,
43235,NC_000913,"1,293,033",MOB,IS1 (+) +9 bp,"hns, tdk",,global DNA-binding transcriptional dual regulator H-NS/thymidine kinase/deoxyuridine kinase,,,intergenic (‑111/‑486),,,,,,,,,1.00,
43236,NC_000913,"2,917,345",SNP,G→A,barA,,"hybrid sensory histidine kinase, in two-component regulatory system with UvrY",,,G763G (GGG→GGA),,,,,,,,,1.00,
43237,NC_000913,"3,566,544",SNP,C→A,glgP,,glycogen phosphorylase,,,S13I (AGC→ATC),,,,,,,,,1.00,
43238,NC_000913,"149,214",SNP,C→T,panB,,3-methyl-2-oxobutanoate hydroxymethyltransferase,,,A130T (GCC→ACC),,1.00,,,,,,,,
43239,NC_000913,"219,624",SNP,A→G,rcsF,,putative outer membrane protein,,,C124C (TGT→TGC),,1.00,,,,,,,,
43240,NC_000913,"232,959",SNP,C→T,mltD,,putative membrane-bound lytic murein transglycosylase D,,,A333T (GCC→ACC),,1.00,,,,,,,,
43241,NC_000913,"321,564",DEL,(G)7→6,"rclR, ykgE",,"reactive chlorine species (RCS)-specific activator of the rcl genes/cysteine-rich LutA family protein, putative electron transport chain YkgEFG component",,,intergenic (+483/‑44),,1.00,,,,,,,,
43242,NC_000913,"401,548",INS,(G)5→6,iraP,,"anti-RssB factor, RpoS stabilzer during Pi starvation, anti-adapter protein",,,coding (163/261 nt),,1.00,,,,,,,,
43243,NC_000913,"429,143",SNP,C→T,secD,,SecYEG protein translocase auxillary subunit,,,G499G (GGC→GGT),,1.00,,,,,,,,
43244,NC_000913,"701,381",DEL,(C)5→4,nagC,,N-acetylglucosamine-inducible nag divergent operon transcriptional repressor,,,coding (214/1221 nt),,1.00,,,,,,,,
43245,NC_000913,"701,958",SNP,C→T,nagA,,N-acetylglucosamine-6-phosphate deacetylase,,,G265D (GGC→GAC),,1.00,,,,,,,,
43246,NC_000913,"703,652",SNP,A→G,"nagB, nagE",,"glucosamine-6-phosphate deaminase/N-acetyl glucosamine specific PTS enzyme IIC, IIB, and IIA components",,,intergenic (‑41/‑292),,1.00,,,,,,,,
43247,NC_000913,"902,610",INS,(T)6→7,artI,,arginine transporter subunit,,,coding (379/732 nt),,1.00,,,,,,,,
43248,NC_000913,"945,268",SNP,A→G,ycaC,,putative isochorismatase family hydrolase,,,V97A (GTA→GCA),,1.00,,,,,,,,
43249,NC_000913,"949,526",SNP,C→T,ycaN,,LysR family putative transcriptional regulator,,,A15T (GCC→ACC),,1.00,,,,,,,,
43250,NC_000913,"1,063,365",SNP,A→G,cbpA,,"DnaK co-chaperone, curved DNA-binding protein",,,R137R (CGT→CGC),,1.00,,,,,,,,
43251,NC_000913,"1,119,438",SNP,A→G,yceO,,uncharacterized protein,,,F4L (TTT→CTT),,1.00,,,,,,,,
43252,NC_000913,"1,144,312",SNP,A→G,rne,,"endoribonuclease, RNA-binding protein,RNA degradosome binding protein",,,V19A (GTA→GCA),,1.00,,,,,,,,
43253,NC_000913,"1,170,795",SNP,G→A,mfd,,transcription-repair coupling factor,,,A1057V (GCG→GTG),,1.00,,,,,,,,
43254,NC_000913,"1,331,289",SNP,C→T,topA,,"DNA topoisomerase I, omega subunit",,,A81V (GCG→GTG),,1.00,,,,,,,,
43255,NC_000913,"1,795,485",SNP,G→A,ihfA,,"integration host factor (IHF), DNA-binding protein, alpha subunit",,,A23V (GCC→GTC),,1.00,,,,,,,,
43256,NC_000913,"1,878,650",SNP,T→C,yeaP,,diguanylate cyclase,,,S312S (AGT→AGC),,1.00,,,,,,,,
43257,NC_000913,"2,359,914",SNP,G→C,rhmT,,putative L-rhamnonate transporter,,,A80G (GCC→GGC),,1.00,,,,,,,,
43258,NC_000913,"2,462,889",INS,(C)9→10,"fadL, yfdF",,long-chain fatty acid outer membrane transporter/uncharacterized protein,,,intergenic (+243/‑123),,1.00,,,,,,,,
43259,NC_000913,"2,809,774",DEL,(T)7→6,ygaZ,,"putative L-valine exporter, norvaline resistance protein",,,coding (158/738 nt),,1.00,,,,,,,,
43260,NC_000913,"2,824,686",SNP,G→A,mltB,,membrane-bound lytic murein transglycosylase B,,,A297A (GCC→GCT),,1.00,,,,,,,,
43261,NC_000913,"2,888,564",SNP,T→C,cysI,,"sulfite reductase, beta subunit, NAD(P)-binding, heme-binding",,,T512T (ACA→ACG),,1.00,,,,,,,,
43262,NC_000913,"3,271,600",INS,(C)5→6,garK,,glycerate kinase I,,,coding (171/1146 nt),,1.00,,,,,,,,
43263,NC_000913,"3,346,530",SNP,C→A,"hpf, ptsN",,"ribosome hibernation promoting factor HPF, stabilizes 100S dimers/sugar-specific enzyme IIA component of PTS",,,intergenic (+70/‑48),,1.00,,,,,,,,
