Reference Seq,Position,Mutation Type,Sequence Change,Gene,Function,Product,GO Process,GO Component,Mut ID,Details,SSW GLU XYL A1 F163 I0 R1,SSW GLU XYL A1 F163 I0 R2,SSW GLU XYL A1 F163 I1 R1,SSW GLU XYL A1 F163 I2 R1,SSW GLU XYL A1 F163 I3 R1,SSW GLU XYL A1 F163 I4 R1,SSW GLU XYL A1 F163 I5 R1,SSW GLU XYL A1 F163 I6 R1,SSW GLU XYL A1 F163 I7 R1,SSW GLU XYL A1 F163 I8 R1,SSW GLU XYL A2 F165 I0 R1,SSW GLU XYL A2 F165 I0 R2,SSW GLU XYL A2 F165 I0 R3,SSW GLU XYL A2 F165 I0 R4,SSW GLU XYL A2 F165 I1 R1,SSW GLU XYL A2 F165 I2 R1,SSW GLU XYL A3 F164 I0 R1,SSW GLU XYL A3 F164 I0 R2,SSW GLU XYL A3 F164 I1 R1,SSW GLU XYL A3 F164 I2 R1,SSW GLU XYL A3 F164 I3 R1,SSW GLU XYL A3 F164 I4 R1,SSW GLU XYL A3 F164 I5 R1,SSW GLU XYL A3 F164 I6 R1,SSW GLU XYL A3 F164 I7 R1,SSW GLU XYL A3 F164 I8 R1,SSW GLU XYL A3 F164 I9 R1,SSW GLU XYL A3 F164 I10 R1,SSW GLU XYL A3 F164 I11 R1
43521,NC_000913,"268,810",SNP,T→C,ykfA,,"CP4-6 prophage, putative GTP-binding protein",,,S51G (AGT→GGT),,,,,,,,,1.00,,,,,,,,,,,,,,,,,,,,
43527,NC_000913,"2,911,480",DEL,Δ12 bp,relA,,(p)ppGpp synthetase I/GTP pyrophosphokinase,,,coding (2161‑2172/2235 nt),,,,,,,1.00,,,,,,,,,,,,,,,,,,,,,,
43530,NC_000913,"3,932,937",SNP,G→A,kup,,potassium transporter,,,G541D (GGT→GAT),,,,,,,,,1.00,,,,,,,,,,,,,,,,,,,,
43534,NC_000913,"4,397,612",DEL,Δ6 bp,mutL,,methyl-directed mismatch repair protein,,,coding (201‑206/1848 nt),0.26,,,,,,,,,,,,,,,,,,,,,,,,,,,,
43535,NC_000913,"2,913,506",DEL,Δ1 bp,relA,,(p)ppGpp synthetase I/GTP pyrophosphokinase,,,coding (146/2235 nt),,,,,,,,,,,,,,,,,,,,,,,,1.00,,,,,
43536,NC_000913,"200,703",INS,+T,skp,,periplasmic chaperone,,,coding (222/486 nt),,,,,,,1.00,,,,,,,,,,,,,,,,,,,,,,
43537,NC_000913,"1,393,457",MOB,IS186 (–) +5 bp,mppA,,murein tripeptide (L-ala-gamma-D-glutamyl-meso-DAP) transporter subunit,,,coding (231‑235/1614 nt),,,,,,,1.00,,,,,,,,,,,,,,,,,,,,,,
43538,NC_000913,"3,273,052",SNP,C→T,garL,,alpha-dehydro-beta-deoxy-D-glucarate aldolase,,,G169D (GGC→GAC),,,,,,,1.00,,,,,,,,,,,,,,,,,,,,,,
44051,NC_000913,"3,290,540",SNP,T→G,yraJ,,putative outer membrane protein,,,L576* (TTA→TGA),,,,,,,,,,,,,,,,,,,,,1.00,,,,,,,,
43540,NC_000913,"2,912,984",SNP,A→G,relA,,(p)ppGpp synthetase I/GTP pyrophosphokinase,,,L223P (CTC→CCC),,,,,,,,,,,,,,,,,,,,,,,,,1.00,,,,
43541,NC_000913,"2,912,999",SNP,A→G,relA,,(p)ppGpp synthetase I/GTP pyrophosphokinase,,,L218P (CTG→CCG),,,,,,,,,,,,,,,,,,,1.00,,,,,,,,,,
43542,NC_000913,"4,392,809",DEL,(T)7→6,"glyY, yjeV",,tRNA-Gly/uncharacterized protein,,,intergenic (+151/‑83),,,,,,,,,,,,,,,,,,,1.00,,,,,,,,,,
43543,NC_000913,"246,960",SNP,A→G,yafL,,putative lipoprotein and C40 family peptidase,,,K83K (AAA→AAG),,,,,,,,,,1.00,,,,,,,,,,,,,,,,,,,
43544,NC_000913,"271,227",SNP,A→G,insI1,,IS30 transposase,,,T209A (ACG→GCG),,,,,,,,,,1.00,,,,,,,,,,,,,,,,,,,
43545,NC_000913,"507,927",SNP,T→C,ybaP,,TraB family protein,,,T52A (ACC→GCC),,,,,,,,,,1.00,,,,,,,,,,,,,,,,,,,
43546,NC_000913,"575,786",DEL,"Δ4,202 bp","[nmpC], essD, rrrD, rzpD, rzoD, borD, ybcV, [ybcW]",,"[nmpC], essD, rrrD, rzpD, rzoD, borD, ybcV, [ybcW]",,,IS5‑mediated,,,,,,,,,,1.00,,,,,,,,,,,,,,,,,,,
43547,NC_000913,"700,870",SNP,A→G,nagC,,N-acetylglucosamine-inducible nag divergent operon transcriptional repressor,,,V242A (GTC→GCC),,,,,,,,,,1.00,,,,,,,,,,,,,,,,,,,
39452,NC_000913,"380,021",DEL,(G)10→8,"frmR, yaiO",,regulator protein that represses frmRAB operon/outer membrane protein,,,intergenic (‑140/+47),,,,,,,,,,1.00,,,,,,,,,,,,,,,,,,,
43549,NC_000913,"1,594,132",DEL,(C)8→7,yneO,,"pseudogene, AidA homolog",,,pseudogene (3856/3861 nt),,,,,,,,,,1.00,,,,,,,,,,,,,,,,,,,
43550,NC_000913,"1,707,028",SNP,T→C,rsxC,,"SoxR iron-sulfur cluster reduction factor component, putative membrane-associated NADH oxidoreductase of electron transport complex",,,V37A (GTA→GCA),,,,,,,,,,1.00,,,,,,,,,,,,,,,,,,,
43551,NC_000913,"1,830,360",SNP,T→C,astA,,arginine succinyltransferase,,,N136D (AAC→GAC),,,,,,,,,,1.00,,,,,,,,,,,,,,,,,,,
43552,NC_000913,"2,048,553",SNP,G→A,yeeJ,,putative adhesin,,,G1206S (GGC→AGC),,,,,,,,,,1.00,,,,,,,,,,,,,,,,,,,
43553,NC_000913,"2,687,541",DEL,Δ1 bp,glrR,,response regulator regulating glmY sRNA in two-component system with sensor protein GlrK,,,coding (1263/1335 nt),,,,,,,,,,1.00,,,,,,,,,,,,,,,,,,,
43554,NC_000913,"2,723,934",SNP,A→G,pssA,,"phosphatidylserine synthase, CDP-diacylglycerol-serine O-phosphatidyltransferase",,,K403R (AAA→AGA),,,,,,,,,,1.00,,,,,,,,,,,,,,,,,,,
43555,NC_000913,"2,958,612",SNP,T→C,ptrA,,protease III,,,E91E (GAA→GAG),,,,,,,,,,1.00,,,,,,,,,,,,,,,,,,,
43556,NC_000913,"2,973,798",SNP,G→A,lplT,,lysophospholipid transporter,,,A22V (GCG→GTG),,,,,,,,,,1.00,,,,,,,,,,,,,,,,,,,
44069,NC_000913,209,SNP,C→T,thrL,,thr operon leader peptide,,,T7I (ACC→ATC),,,,,,1.00,,,,,,,,,,,,,,,,,,,,,,,
44070,NC_000913,"173,011",SNP,A→G,fhuB,,iron(3+)-hydroxamate import ABC transporter permease,,,Y517C (TAC→TGC),,,,,,1.00,,,,,,,,,,,,,,,,,,,,,,,
44071,NC_000913,"222,672",SNP,A→G,"metN, gmhB",,"DL-methionine transporter subunit/D,D-heptose 1,7-bisphosphate phosphatase",,,intergenic (‑27/‑161),,,,,,1.00,,,,,,,,,,,,,,,,,,,,,,,
44072,NC_000913,"308,054",INS,(C)7→8,ecpC,,ECP production outer membrane protein,,,coding (1279/2526 nt),,,,,,1.00,,,,,,,,,,,,,,,,,,,,,,,
44073,NC_000913,"661,068",SNP,A→G,ybeF,,LysR family putative transcriptional regulator,,,L104P (CTT→CCT),,,,,,1.00,,,,,,,,,,,,,,,,,,,,,,,
44074,NC_000913,"824,554",INS,(A)5→6,"ybhP, ybhQ",,endo/exonuclease/phosphatase family protein/inner membrane protein,,,intergenic (‑57/‑76),,,,,,1.00,,,,,,,,,,,,,,,,,,,,,,,
44075,NC_000913,"851,102",SNP,T→C,opgE,,OPG biosynthetic transmembrane phosphoethanolamine transferase,,,K499R (AAA→AGA),,,,,,1.00,,,,,,,,,,,,,,,,,,,,,,,
44076,NC_000913,"890,497",SNP,C→T,grxA,,"glutaredoxin 1, redox coenzyme for ribonucleotide reductase (RNR1a)",,,*86* (TGA→TAA),,,,,,1.00,,,,,,,,,,,,,,,,,,,,,,,
44077,NC_000913,"959,180",SNP,A→G,aroA,,5-enolpyruvylshikimate-3-phosphate synthetase,,,E123E (GAA→GAG),,,,,,1.00,,,,,,,,,,,,,,,,,,,,,,,
44078,NC_000913,"1,217,830",SNP,T→C,ycgG,,putative membrane-anchored cyclic-di-GMP phosphodiesterase,,,V168A (GTA→GCA),,,,,,1.00,,,,,,,,,,,,,,,,,,,,,,,
44079,NC_000913,"1,685,757",SNP,G→A,fumC,,"fumarate hydratase (fumarase C),aerobic Class II",,,H278Y (CAC→TAC),,,,,,1.00,,,,,,,,,,,,,,,,,,,,,,,
44080,NC_000913,"1,881,353",SNP,C→T,dmlR,,transcriptional activator of dmlA,,,A153T (GCC→ACC),,,,,,1.00,,,,,,,,,,,,,,,,,,,,,,,
44081,NC_000913,"2,261,060",SNP,T→C,fruA,,fused fructose-specific PTS enzymes: IIBcomponent/IIC components,,,A117A (GCA→GCG),,,,,,1.00,,,,,,,,,,,,,,,,,,,,,,,
44082,NC_000913,"2,482,295",SNP,G→A,emrK,,multidrug resistance efflux pump membrane fusion protein,,,P349S (CCT→TCT),,,,,,1.00,,,,,,,,,,,,,,,,,,,,,,,
44083,NC_000913,"2,687,071",SNP,T→C,glnB,,regulatory protein P-II for glutamine synthetase,,,*113* (TAA→TGA),,,,,,1.00,,,,,,,,,,,,,,,,,,,,,,,
44084,NC_000913,"2,763,681",SNP,T→C,yfjL,,"CP4-57 putative defective prophage, DUF4297/DUF1837 polymorphic toxin family protein",,,T491T (ACA→ACG),,,,,,1.00,,,,,,,,,,,,,,,,,,,,,,,
44085,NC_000913,"2,794,154",SNP,G→A,"gabT, gabP",,"4-aminobutyrate aminotransferase, PLP-dependent/gamma-aminobutyrate transporter",,,intergenic (+139/‑99),,,,,,1.00,,,,,,,,,,,,,,,,,,,,,,,
44086,NC_000913,"2,854,172",SNP,G→A,hypE,,"carbamoyl dehydratase, hydrogenases 1,2,3 maturation protein",,,V307M (GTG→ATG),,,,,,1.00,,,,,,,,,,,,,,,,,,,,,,,
44087,NC_000913,"2,918,955",SNP,T→C,gudD,,D-glucarate dehydratase 1,,,E144G (GAA→GGA),,,,,,1.00,,,,,,,,,,,,,,,,,,,,,,,
44088,NC_000913,"3,411,876",SNP,T→C,yhdJ,,"DNA adenine methyltransferase, SAM-dependent",,,V75A (GTT→GCT),,,,,,1.00,,,,,,,,,,,,,,,,,,,,,,,
44089,NC_000913,"3,453,126",SNP,A→G,rpsJ,,30S ribosomal subunit protein S10,,,F49L (TTC→CTC),,,,,,1.00,,,,,,,,,,,,,,,,,,,,,,,
44090,NC_000913,"3,462,909",SNP,C→T,gspJ,,"putative general secretory pathway component, cryptic",,,A189V (GCC→GTC),,,,,,1.00,,,,,,,,,,,,,,,,,,,,,,,
44091,NC_000913,"3,609,639",SNP,G→A,yhhQ,,DUF165 family inner membrane protein,,,L141L (CTG→CTA),,,,,,1.00,,,,,,,,,,,,,,,,,,,,,,,
44092,NC_000913,"3,619,269",SNP,A→G,rhsB,,"Rhs protein with DUF4329 family putative toxin domain, putative neighboring cell growth inhibitor",,,V26V (GTA→GTG),,,,,,1.00,,,,,,,,,,,,,,,,,,,,,,,
44093,NC_000913,"3,619,272",SNP,T→C,rhsB,,"Rhs protein with DUF4329 family putative toxin domain, putative neighboring cell growth inhibitor",,,R27R (CGT→CGC),,,,,,1.00,,,,,,,,,,,,,,,,,,,,,,,
44094,NC_000913,"3,622,299",SNP,G→A,rhsB,,"Rhs protein with DUF4329 family putative toxin domain, putative neighboring cell growth inhibitor",,,T1036T (ACG→ACA),,,,,,1.00,,,,,,,,,,,,,,,,,,,,,,,
44095,NC_000913,"3,622,314",SNP,G→A,rhsB,,"Rhs protein with DUF4329 family putative toxin domain, putative neighboring cell growth inhibitor",,,R1041R (AGG→AGA),,,,,,1.00,,,,,,,,,,,,,,,,,,,,,,,
44096,NC_000913,"3,622,316",SNP,G→C,rhsB,,"Rhs protein with DUF4329 family putative toxin domain, putative neighboring cell growth inhibitor",,,S1042T (AGC→ACC),,,,,,1.00,,,,,,,,,,,,,,,,,,,,,,,
44097,NC_000913,"3,628,900",SNP,T→C,rbbA,,ribosome-associated ATPase: ATP-binding protein/ATP-binding membrane protein,,,E213E (GAA→GAG),,,,,,1.00,,,,,,,,,,,,,,,,,,,,,,,
44098,NC_000913,"4,168,472",SNP,G→A,"gltT, rrlB",,tRNA-Glu/23S ribosomal RNA of rrnB operon,,,intergenic (+25/‑169),,,,,,1.00,,,,,,,,,,,,,,,,,,,,,,,
44099,NC_000913,"4,168,475",SUB,2 bp→TG,"gltT, rrlB",,tRNA-Glu/23S ribosomal RNA of rrnB operon,,,intergenic (+28/‑165),,,,,,1.00,,,,,,,,,,,,,,,,,,,,,,,
44100,NC_000913,"4,168,571",SNP,G→A,"gltT, rrlB",,tRNA-Glu/23S ribosomal RNA of rrnB operon,,,intergenic (+124/‑70),,,,,,1.00,,,,,,,,,,,,,,,,,,,,,,,
44101,NC_000913,"4,168,618",SNP,A→T,"gltT, rrlB",,tRNA-Glu/23S ribosomal RNA of rrnB operon,,,intergenic (+171/‑23),,,,,,1.00,,,,,,,,,,,,,,,,,,,,,,,
44102,NC_000913,"4,288,058",SNP,A→G,nrfA,,"nitrite reductase, formate-dependent, cytochrome",,,T99A (ACC→GCC),,,,,,1.00,,,,,,,,,,,,,,,,,,,,,,,
26183,NC_000913,"1,978,503",DEL,Δ776 bp,"insB1, insA",,"insB1, insA",,,,,,1.00,1.00,1.00,1.00,1.00,1.00,1.00,1.00,,,,,1.00,1.00,,1.00,1.00,1.00,1.00,1.00,1.00,1.00,1.00,1.00,1.00,1.00,1.00
44104,NC_000913,"176,134",SNP,C→T,clcA,,H(+)/Cl(-) exchange transporter,,,T343I (ACC→ATC),,,,,,,,,1.00,,,,,,,,,,,,,,,,,,,,
44105,NC_000913,"221,277",SNP,G→A,metI,,DL-methionine transporter subunit,,,I115I (ATC→ATT),,,,,,,,,1.00,,,,,,,,,,,,,,,,,,,,
44106,NC_000913,"291,529",SNP,G→A,yagJ,,"CP4-6 prophage, uncharacterized protein,Phage or Prophage Related",,,pseudogene (126/828 nt),,,,,,,,,1.00,,,,,,,,,,,,,,,,,,,,
44107,NC_000913,"387,569",SNP,T→C,tauC,,taurine ABC transporter permease,,,L200P (CTC→CCC),,,,,,,,,1.00,,,,,,,,,,,,,,,,,,,,
44108,NC_000913,"527,078",INS,(G)6→7,rhsD,,"Rhs protein with DUF4329 family putative toxin domain, putative neighboring cell growth inhibitor",,,coding (3818/4281 nt),,,,,,,,,1.00,,,,,,,,,,,,,,,,,,,,
44109,NC_000913,"609,147",INS,(C)7→8,insL1,,IS186 transposase,,,coding (1083/1113 nt),,,,,,,,,1.00,,,,,,,,,,,,,,,,,,,,
44110,NC_000913,"709,028",DEL,(A)5→4,chiP,,"chitoporin, uptake of chitosugars",,,coding (695/1407 nt),,,,,,,,,1.00,,,,,,,,,,,,,,,,,,,,
26191,NC_000913,"1,299,499",DEL,"Δ1,199 bp","ychE, oppA",,UPF0056 family inner membrane protein/oligopeptide ABC transporter periplasmic binding protein,,,intergenic (+254/‑485),,,,,,1.00,,1.00,,,,,,,,,,1.00,,,1.00,1.00,1.00,,1.00,,1.00,,1.00
44112,NC_000913,"1,089,069",INS,(T)7→8,pgaB,,"poly-beta-1,6-N-acetyl-D-glucosamine (PGA) N-deacetylase outer membrane export lipoprotein",,,coding (789/2019 nt),,,,,,,,,1.00,,,,,,,,,,,,,,,,,,,,
44113,NC_000913,"1,124,108",DEL,(G)6→5,"grxB, mdtH",,glutaredoxin 2 (Grx2)/multidrug resistance efflux transporter conferring overexpression resistance to norfloxacin and enoxacin,,,intergenic (‑54/+10),,,,,,,,,1.00,,,,,,,,,,,,,,,,,,,,
44114,NC_000913,"1,415,000",SNP,T→C,recE,,"Rac prophage, exonuclease VIII, 5' to 3' specific dsDNA exonuclease",,,Q796R (CAG→CGG),,,,,,,,,1.00,,,,,,,,,,,,,,,,,,,,
44115,NC_000913,"1,803,243",SNP,G→A,arpB,,"pseudogene, ankyrin repeats",,,pseudogene (150/426 nt),,,,,,,,,1.00,,,,,,,,,,,,,,,,,,,,
44116,NC_000913,"1,879,829",MOB,Δ1 bp :: IS186 (–) +6 bp :: Δ1 bp,yeaR,,"DUF1971 family protein, nitrate-inducible",,,coding (115‑120/360 nt),,,,,,,,,1.00,,,,,,,,,,,,,,,,,,,,
44117,NC_000913,"2,287,732",SNP,G→A,yejO,,"pseudogene, autotransporter outer membrane homology,putative transport, Not classified, putative ATP-binding component of a transport system",,,pseudogene (1183/2525 nt),,,,,,,,,1.00,,,,,,,,,,,,,,,,,,,,
44118,NC_000913,"2,488,076",SNP,C→T,yfdE,,acetyl-CoA:oxalate CoA-transferase,,,A365T (GCG→ACG),,,,,,,,,1.00,,,,,,,,,,,,,,,,,,,,
44119,NC_000913,"2,860,372",SNP,G→A,pphB,,serine/threonine-specific protein phosphatase 2,,,G205R (GGA→AGA),,,,,,,,,1.00,,,,,,,,,,,,,,,,,,,,
44120,NC_000913,"3,199,319",SNP,G→A,glnE,,fused deadenylyltransferase/adenylyltransferase for glutamine synthetase,,,A108V (GCA→GTA),,,,,,,,,1.00,,,,,,,,,,,,,,,,,,,,
44121,NC_000913,"3,354,228",INS,(T)7→8,"yhcC, gltB",,"putative Fe-S oxidoreductase, Radical SAM superfamily protein/glutamate synthase, large subunit",,,intergenic (‑178/‑497),,,,,,,,,1.00,,,,,,,,,,,,,,,,,,,,
44122,NC_000913,"3,695,582",SNP,T→C,bcsQ,,"involved in cellulose production, minD superfamily (pseudogene)",,,pseudogene (404/753 nt),,,,,,,,,1.00,,,,,,,,,,,,,,,,,,,,
44123,NC_000913,"3,793,483",MOB,IS2 (+) +5 bp,yibB,,"YibB family protein, function unknown",,,coding (197‑201/858 nt),,,,,,,,,1.00,,,,,,,,,,,,,,,,,,,,
44124,NC_000913,"4,126,271",SNP,T→C,priA,,Primosome factor n' (replication factor Y),,,T180T (ACA→ACG),,,,,,,,,1.00,,,,,,,,,,,,,,,,,,,,
44125,NC_000913,"4,200,773",SNP,A→G,yjaH,,DUF1481 family putative lipoprotein,,,S70G (AGC→GGC),,,,,,,,,1.00,,,,,,,,,,,,,,,,,,,,
44126,NC_000913,"4,547,814",SNP,A→G,fimF,,minor component of type 1 fimbriae,,,S25G (AGC→GGC),,,,,,,,,1.00,,,,,,,,,,,,,,,,,,,,
44127,NC_000913,"4,640,850",SNP,C→T,"yjjY, yjtD",,uncharacterized protein/putative methyltransferase,,,intergenic (+308/‑92),,,,,,,,,1.00,,,,,,,,,,,,,,,,,,,,
44128,NC_000913,"337,157",SNP,C→A,yahF,,putative NAD(P)-binding succinyl-CoA synthase,,,A127D (GCT→GAT),,,,,,,,,,,,,,,,,,,,,,,1.00,,,,,,
44129,NC_000913,"838,183",SNP,G→T,"ybiJ, ybiI",,DUF1471 family putative periplasmic protein/DksA-type zinc finger protein,,,intergenic (‑258/+7),,,,,,,,,,,,,,,,,,,,,,,1.00,,,,,,
44137,NC_000913,"2,973,929",SNP,A→C,aas,,fused 2-acylglycerophospho-ethanolamine acyl transferase/acyl-acyl carrier protein synthetase,,,L696V (TTA→GTA),,,,,,,,,,,,,,,,,,,,,,,,,,,,,1.00
44138,NC_000913,"88,334",SNP,C→T,cra,,transcriptional repressor-activator for carbon metabolism,,,P103S (CCA→TCA),,,1.00,,,,,,,,,,,,,,,,,,,,,,,,,,
44139,NC_000913,"191,723",SNP,C→T,"tsf, pyrH",,translation elongation factor EF-Ts/uridylate kinase,,,intergenic (+15/‑132),,,1.00,,,,,,,,,,,,,,,,,,,,,,,,,,
44140,NC_000913,"240,031",SNP,T→C,yafV,,putative NAD(P)-binding C-N hydrolase family amidase,,,A53A (GCA→GCG),,,1.00,,,,,,,,,,,,,,,,,,,,,,,,,,
44141,NC_000913,"281,708",SNP,T→C,yagA,,"CP4-6 prophage, putative DNA-binding transcriptional regulator",,,G92G (GGA→GGG),,,1.00,,,,,,,,,,,,,,,,,,,,,,,,,,
44142,NC_000913,"320,847",SNP,G→A,rclR,,reactive chlorine species (RCS)-specific activator of the rcl genes,,,R207R (CGG→CGA),,,1.00,,,,,,,,,,,,,,,,,,,,,,,,,,
44143,NC_000913,"538,489",SNP,C→T,ybbW,,putative allantoin transporter,,,A286V (GCC→GTC),,,1.00,,,,,,,,,,,,,,,,,,,,,,,,,,
44144,NC_000913,"647,385",SNP,A→G,citG,,2-(5''-triphosphoribosyl)-3'-dephosphocoenzyme-A synthase,,,V42A (GTG→GCG),,,1.00,,,,,,,,,,,,,,,,,,,,,,,,,,
44145,NC_000913,"864,985",SNP,A→G,moeB,,molybdopterin synthase sulfurylase,,,Y49H (TAT→CAT),,,1.00,,,,,,,,,,,,,,,,,,,,,,,,,,
44146,NC_000913,"1,121,967",SNP,C→T,pyrC,,dihydro-orotase,,,G214E (GGA→GAA),,,1.00,,,,,,,,,,,,,,,,,,,,,,,,,,
44147,NC_000913,"1,145,744",SNP,C→T,rluC,,"23S rRNA pseudouridine(955,2504,2580) synthase",,,Q269* (CAG→TAG),,,1.00,,,,,,,,,,,,,,,,,,,,,,,,,,
44148,NC_000913,"1,258,523",SNP,T→C,"pth, ychH",,peptidyl-tRNA hydrolase/DUF2583 family putative inner membrane protein,,,intergenic (‑10/‑268),,,1.00,,,,,,,,,,,,,,,,,,,,,,,,,,
44149,NC_000913,"1,314,127",SNP,A→G,ompW,,outer membrane protein W,,,V36V (GTA→GTG),,,1.00,,,,,,,,,,,,,,,,,,,,,,,,,,
44150,NC_000913,"1,378,342",SNP,C→T,ycjT,,putative family 65 glycosyl hydrolase,,,D153D (GAC→GAT),,,1.00,,,,,,,,,,,,,,,,,,,,,,,,,,
44151,NC_000913,"1,781,073",SNP,G→A,ydiR,,"putative electron transfer flavoprotein, FAD-binding subunit",,,G225S (GGC→AGC),,,1.00,,,,,,,,,,,,,,,,,,,,,,,,,,
44152,NC_000913,"1,831,190",SNP,C→T,astC,,"succinylornithine transaminase, PLP-dependent",,,A265T (GCA→ACA),,,1.00,,,,,,,,,,,,,,,,,,,,,,,,,,
44153,NC_000913,"1,883,341",INS,(G)6→7,yeaV,,putative transporter,,,coding (154/1446 nt),,,1.00,,,,,,,,,,,,,,,,,,,,,,,,,,
44154,NC_000913,"2,047,530",SNP,G→A,yeeJ,,putative adhesin,,,V865I (GTC→ATC),,,1.00,,,,,,,,,,,,,,,,,,,,,,,,,,
44155,NC_000913,"2,183,628",INS,(T)7→8,yegX,,putative family 25 glycosyl hydrolase,,,coding (24/819 nt),,,1.00,,,,,,,,,,,,,,,,,,,,,,,,,,
44156,NC_000913,"2,296,831",SNP,G→A,ccmB,,heme export ABC transporter permease,,,A65V (GCG→GTG),,,1.00,,,,,,,,,,,,,,,,,,,,,,,,,,
44157,NC_000913,"2,515,413",INS,(C)7→8,insL1,,IS186 transposase,,,coding (1083/1113 nt),,,1.00,,,,,,,,,,,,,,,,,,,,,,,,,,
44158,NC_000913,"2,638,749",SNP,T→C,yfgM,,"ancillary SecYEG translocon subunit, putative anti-RcsB factor",,,S179G (AGT→GGT),,,1.00,,,,,,,,,,,,,,,,,,,,,,,,,,
44159,NC_000913,"2,856,252",SNP,G→A,fhlA,,formate hydrogenlyase transcriptional activator,,,A639T (GCC→ACC),,,1.00,,,,,,,,,,,,,,,,,,,,,,,,,,
44160,NC_000913,"3,202,425",SNP,A→G,cca,,fused tRNA nucleotidyl transferase/2'3'-cyclic phosphodiesterase/2'nucleotidase and phosphatase,,,K179E (AAA→GAA),,,1.00,,,,,,,,,,,,,,,,,,,,,,,,,,
44161,NC_000913,"3,255,057",SNP,G→A,yhaL,,uncharacterized protein,,,L5L (TTG→TTA),,,1.00,,,,,,,,,,,,,,,,,,,,,,,,,,
44162,NC_000913,"3,304,813",INS,(C)7→8,mtr,,tryptophan transporter of high affinity,,,coding (1005/1245 nt),,,1.00,,,,,,,,,,,,,,,,,,,,,,,,,,
44163,NC_000913,"3,982,684",INS,(C)8→10,leuT,,tRNA-Leu,,,noncoding (79/87 nt),,,1.00,,,,,,,,,,,,,,,,,,,,,,,,,,
44164,NC_000913,"4,203,611",SNP,A→G,zraR,,fused DNA-binding response regulator in two-component regulatory system with ZraS: response regulator/sigma54 interaction protein,,,T98A (ACT→GCT),,,1.00,,,,,,,,,,,,,,,,,,,,,,,,,,
44165,NC_000913,"3,440,253",SNP,A→C,rpoA,,"RNA polymerase, alpha subunit",,,D259E (GAT→GAG),,,,,1.00,,,,,,,,,,,,,,,,,,,,,,,,
43548,NC_000913,"1,212,088",DEL,(C)8→7,"iraM, ycgX",,"RpoS stabilzer during Mg starvation, anti-RssB factor/DUF1398 family protein",,,intergenic (‑85/+615),,,,,,,,,,1.00,,,,,,,,,,,,,,,,,,,
44065,NC_000913,"1,293,196",MOB,IS5 (+) +4 bp,"hns, tdk",,global DNA-binding transcriptional dual regulator H-NS/thymidine kinase/deoxyuridine kinase,,,intergenic (‑274/‑328),,,,,,,,,,,,,,,,,,,,1.00,,,,,,,,,
44066,NC_000913,"1,915,413",SNP,T→C,proQ,,"RNA chaperone, putative ProP translation regulator",,,D41G (GAT→GGT),,,,,,,,,,,,,,,,,,,,1.00,,,,,,,,,
44103,NC_000913,"4,428,993",SNP,A→G,fklB,,FKBP-type peptidyl-prolyl cis-trans isomerase (rotamase),,,Q20R (CAG→CGG),,,,,,1.00,,,,,,,,,,,,,,,,,,,,,,,
44067,NC_000913,"3,815,811",SNP,C→T,"pyrE, rph",,"orotate phosphoribosyltransferase/ribonuclease PH (defective),enzyme, Degradation of RNA, RNase PH",,,intergenic (‑43/+23),,,,,,,,,,,,,,,,,,,,1.00,,,,,,,,,
44068,NC_000913,"4,299,397",SNP,T→G,"fdhF, mdtP",,"formate dehydrogenase-H, selenopolypeptide subunit/outer membrane factor of efflux pump",,,intergenic (‑31/+167),,,,,,,,,,,,,,,,,,,,1.00,,,,,,,,,
43229,NC_000913,"4,410,053",DEL,(T)9→8,"rlmB, yjfI",,"23S rRNA mG2251 2'-O-ribose methyltransferase, SAM-dependent/DUF2170 family protein",,,intergenic (+47/‑80),,,,,,1.00,,,,,,,,,,,,,,,,,,,,,,,
43557,NC_000913,"2,999,680",INS,(G)7→8,ygeR,,"LysM domain-containing M23 family putative peptidase, septation lipoprotein",,,coding (212/756 nt),,,,,,,,,,1.00,,,,,,,,,,,,,,,,,,,
43558,NC_000913,"3,102,677",DEL,(A)5→4,trmI,,"tRNA m(7)G46 methyltransferase, SAM-dependent",,,coding (176/720 nt),,,,,,,,,,1.00,,,,,,,,,,,,,,,,,,,
43559,NC_000913,"3,197,293",SNP,T→C,glnE,,fused deadenylyltransferase/adenylyltransferase for glutamine synthetase,,,E783E (GAA→GAG),,,,,,,,,,1.00,,,,,,,,,,,,,,,,,,,
43560,NC_000913,"3,205,882",SNP,T→C,ttdR,,transcriptional activator of ttdABT,,,L125L (TTA→TTG),,,,,,,,,,1.00,,,,,,,,,,,,,,,,,,,
43561,NC_000913,"3,273,187",SNP,G→A,garL,,alpha-dehydro-beta-deoxy-D-glucarate aldolase,,,S124F (TCC→TTC),,,,,,,,,,1.00,,,,,,,,,,,,,,,,,,,
43562,NC_000913,"3,341,408",SNP,G→A,kdsD,,D-arabinose 5-phosphate isomerase,,,C48Y (TGT→TAT),,,,,,,,,,1.00,,,,,,,,,,,,,,,,,,,
43483,NC_000913,"1,756,826",SNP,G→A,pykF,,pyruvate kinase I,,,A377T (GCT→ACT),,0.61,,,,,,,,,,,,,,,,,,,,,,,,,,,
43563,NC_000913,"3,644,577",SNP,G→A,prlC,,oligopeptidase A,,,A202A (GCC→GCT),,,,,,,,,,1.00,,,,,,,,,,,,,,,,,,,
43564,NC_000913,"3,750,566",SNP,G→A,sgbE,,L-ribulose-5-phosphate 4-epimerase,,,A161T (GCA→ACA),,,,,,,,,,1.00,,,,,,,,,,,,,,,,,,,
43565,NC_000913,"3,853,127",DEL,Δ1 bp,istR,,"sRNA antisense regulators IstR-1 and IstR-2, affectr tisB, Hfq-dependent",,,noncoding (131/140 nt),,,,,,,,,,1.00,,,,,,,,,,,,,,,,,,,
43566,NC_000913,"3,987,439",SNP,G→A,hemY,,putative protoheme IX synthesis protein,,,A148A (GCC→GCT),,,,,,,,,,1.00,,,,,,,,,,,,,,,,,,,
43567,NC_000913,"4,226,960",SNP,G→A,metH,,"homocysteine-N5-methyltetrahydrofolate transmethylase, B12-dependent",,,D1045N (GAC→AAC),,,,,,,,,,1.00,,,,,,,,,,,,,,,,,,,
43568,NC_000913,"4,627,743",SNP,C→T,nadR,,"trifunctional protein: nicotinamide mononucleotide adenylyltransferase, ribosylnicotinamide kinase, transcriptional repressor",,,N143N (AAC→AAT),,,,,,,,,,1.00,,,,,,,,,,,,,,,,,,,
43299,NC_000913,"3,815,810",DEL,Δ1 bp,"pyrE, rph",,"orotate phosphoribosyltransferase/ribonuclease PH (defective),enzyme, Degradation of RNA, RNase PH",,,intergenic (‑42/+24),,1.00,1.00,1.00,1.00,1.00,1.00,1.00,1.00,1.00,,,,,1.00,1.00,,,1.00,,1.00,1.00,1.00,1.00,1.00,1.00,1.00,1.00,1.00
43569,NC_000913,"756,213",SNP,G→T,sdhA,,"succinate dehydrogenase, flavoprotein subunit",,,G103C (GGC→TGC),,,,,,,,,,,,,,,,,,,,,,,,,,1.00,,,
43354,NC_000913,"1,529,218",SNP,C→T,rhsE,,"pseudogene, Rhs family",,,pseudogene (1317/2037 nt),1.00,1.00,1.00,1.00,1.00,1.00,1.00,1.00,1.00,1.00,1.00,1.00,1.00,1.00,1.00,1.00,1.00,1.00,1.00,1.00,1.00,1.00,1.00,1.00,1.00,1.00,1.00,1.00,1.00
43376,NC_000913,"1,355,064",SNP,A→C,sapB,,antimicrobial peptide transport ABC transporter permease,,,L136R (CTC→CGC),,,,,,,,,,,,,,,,,0.44,0.47,,,1.00,,1.00,,,,1.00,1.00,
43377,NC_000913,"1,356,852",SNP,A→T,sapA,,antimicrobial peptide transport ABC transporter periplasmic binding protein,,,W87R (TGG→AGG),,,,,,,,,,,,,,,,,,,,,,1.00,,,,1.00,,,1.00
43381,NC_000913,"1,907,448",MOB,IS5 (–) +4 bp,yobF,,DUF2527 family heat-induced protein,,,coding (141‑144/144 nt),,,,,,,,,,,,,,,,,,,,,,,,,,,,,1.00
43382,NC_000913,"1,907,573",SNP,T→G,yobF,,DUF2527 family heat-induced protein,,,K7Q (AAA→CAA),,,,,,,,,,,,,,,,,0.44,0.69,,,1.00,,1.00,,,,1.00,1.00,
43384,NC_000913,"2,173,361",DEL,Δ2 bp,gatC,,"pseudogene, galactitol-specific enzyme IIC component of PTS,transport, Transport of small molecules: Carbohydrates, organic acids, alcohols, PTS system galactitol-specific enzyme IIC",,,pseudogene (1‑2/442 nt),1.00,,,,,,,,,,1.00,1.00,1.00,1.00,,,1.00,1.00,,,,,,,,,,,
43387,NC_000913,"3,950,469",SNP,T→G,"ilvL, ilvX",,ilvG operon leader peptide/uncharacterized protein,,,intergenic (+49/‑38),,,,,,,,,,,,,,,,,,,,,,1.00,,,,1.00,,,
43388,NC_000913,"4,187,507",SNP,A→C,rpoC,,"RNA polymerase, beta prime subunit",,,N720H (AAC→CAC),1.00,1.00,1.00,1.00,1.00,1.00,1.00,1.00,1.00,1.00,1.00,1.00,1.00,1.00,1.00,1.00,1.00,1.00,1.00,1.00,1.00,1.00,1.00,1.00,1.00,1.00,1.00,1.00,1.00
43389,NC_000913,"4,296,190",SNP,A→G,"gltP, yjcO",,glutamate/aspartate:proton symporter/Sel1 family TPR-like repeat protein,,,intergenic (+396/+246),,0.23,,,,,,,,,,,,0.22,,,,0.29,,,,,,,,,,,
43390,NC_000913,"4,296,191",SNP,A→C,"gltP, yjcO",,glutamate/aspartate:proton symporter/Sel1 family TPR-like repeat protein,,,intergenic (+397/+245),0.22,0.26,,,,,,,,,,,0.23,0.26,,,,0.28,,,,,,,,,,,
43391,NC_000913,"4,296,268",SNP,T→C,"gltP, yjcO",,glutamate/aspartate:proton symporter/Sel1 family TPR-like repeat protein,,,intergenic (+474/+168),0.27,0.22,,,,,,,,,0.33,0.35,0.25,0.30,,,0.32,0.30,,,,,,,,,,,
43392,NC_000913,"4,296,286",SNP,C→T,"gltP, yjcO",,glutamate/aspartate:proton symporter/Sel1 family TPR-like repeat protein,,,intergenic (+492/+150),,,,,,,,,,,0.23,0.23,0.22,,,,,,,,,,,,,,,,
44050,NC_000913,"841,338",SNP,G→T,fiu,,catecholate siderophore receptor,,,S65* (TCG→TAG),,,,,,,,,,,,,,,,,,,,,1.00,,,,,,,,
43395,NC_000913,"4,296,380",INS,+CG,"gltP, yjcO",,glutamate/aspartate:proton symporter/Sel1 family TPR-like repeat protein,,,intergenic (+586/+56),,,,,,,,,,,,1.00,,1.00,,,1.00,1.00,,,,,,,,,,,
43397,NC_000913,"44,145",SNP,C→T,"fixB, fixC",,"putative electron transfer flavoprotein, NAD/FAD-binding domain and ETFP adenine nucleotide-binding domain-like protein/putative oxidoreductase",,,intergenic (+16/‑35),,,,,,,,1.00,,,,,,,,,,,,,,,,,,,,,
43398,NC_000913,"300,196",SNP,A→G,paoC,,"PaoABC aldehyde oxidoreductase, Moco-containing subunit",,,F247L (TTC→CTC),0.56,1.00,1.00,1.00,,1.00,,1.00,1.00,1.00,,,,,,,,,,,,,,,,,,,
